{
 "$schema": "../../schemas/recipe.schema.json",
 "schema": "audiolab.recipe/1",
 "game": "typing-defense",
 "id": "ui-pick",
 "group": "rare-fixed",
 "family": "phim-ui",
 "description": "Lô 1 (BATCH1_BRIEF 4.4): bản cuối phách gỗ VCSL Woodblock wood-click2 rồi chuông Hand Chimes A5 (anh chọn 0a v3, 2b7be772). Hai bản quanh bản 0a: 1) chuông to hơn (velocity 110, khoảng +3 dB); 2) chuông nhỏ hơn (velocity 64, khoảng −4 dB). Phách giữ đúng 0a (cắt 6 ms đầu, lọc cao 600 Hz, +6 dB).",
 "channels": 1,
 "layers": [
  {
   "id": "clapper",
   "role": "attack",
   "source": {
    "sampler": {
     "instrument": "woodblock",
     "notes": "0:wood-click2:0.1:60"
    }
   },
   "filters": [
    {
     "type": "highpass",
     "hz": 600
    }
   ],
   "trim": {
    "startMs": 6,
    "endMs": 70
   },
   "fadeOutMs": 35,
   "fadeInMs": 0.3,
   "gainDb": 6
  },
  {
   "id": "bell",
   "role": "sweetener",
   "offsetMs": 40,
   "gainDb": -14,
   "fadeOutMs": 200,
   "source": {
    "sampler": {
     "instrument": "hand-chimes",
     "notes": "0:A5:0.6:110"
    }
   },
   "vary": {
    "swapMode": "cycle",
    "swap": [
     {
      "sampler": {
       "instrument": "hand-chimes",
       "notes": "0:A5:0.6:64"
      }
     }
    ]
   }
  }
 ],
 "chain": {
  "dcHpfHz": 60,
  "filters": [
   {
    "type": "peak",
    "hz": 2500,
    "gainDb": -2,
    "q": 0.8
   }
  ],
  "headTrim": {
   "thresholdDb": -50,
   "preRollMs": 0.3
  },
  "maxLengthMs": 650,
  "tail": {
   "floorDb": -60,
   "fadeMs": 120
  },
  "normalise": {
   "mode": "lufs-m-max",
   "target": -20
  },
  "limiter": {
   "ceilingDbtp": -1.0,
   "releaseMs": 60,
   "maxGrDb": 6
  }
 },
 "variants": {
  "count": 2,
  "seed": 2602,
  "includeBase": true,
  "pitchCents": [
   0,
   0
  ],
  "gainDb": [
   0,
   0
  ]
 },
 "export": {
  "path": "sfx/ui/ui-pick",
  "ogg": true,
  "oggQuality": 0.6
 }
}
